{
  "authority": {
    "immutable_snapshot_only": true,
    "live_health_authority": false,
    "member_state_authority": false,
    "owner_acceptance_authority": false,
    "registry_authority": false,
    "release_admission_authority": false,
    "repository_state_authority": false
  },
  "candidate_id": "core-shared-skills-candidate-2026-10-23-v3",
  "compatibility": {
    "authority": "owner-descriptors-and-distribution-compatibility",
    "inputs": [
      {
        "path": "release/component-release.json",
        "repository": "aiverse-filmmakers/AI-Verse-OS",
        "revision": "50f9f678eb847dc447560020ecdb74b9ecc7ea20",
        "sha256": "71e8ffd5ffa536192984a93a23b4bb1f98714dd55e4681cf1ab888aa9dc3bdd5"
      },
      {
        "path": "release/component-release.json",
        "repository": "aiverse-filmmakers/AI-Verse-Brain",
        "revision": "6ad408e38b6b876cc8049f207fcba1e86ffd6554",
        "sha256": "f24d2d3f74ca22f7205f6d6e8c2778263908dd489bbf9528f762b5d39acea82d"
      },
      {
        "path": "release/component-release.json",
        "repository": "aiverse-filmmakers/AI-Verse-Memory",
        "revision": "09911eae0b4b0cbf7e7e7969230fe5b86647b841",
        "sha256": "9d8e636691742c7be62b123a944bb16b1e274ae937fc8fabc9c7795539ff1efb"
      },
      {
        "path": "release/component-release.json",
        "repository": "aiverse-filmmakers/AI-Verse-Skills",
        "revision": "297c63a5be95f8319cc5755f287329c2e4387b02",
        "sha256": "94baa36b0cd1a0c5469438447b9293b6b1567f58eb951c802ddcd40509960d38"
      },
      {
        "path": "release/component-release.json",
        "repository": "aiverse-filmmakers/AI-Verse-Data",
        "revision": "7e9fadbd73752b24eb79e270aff6b311ad508109",
        "sha256": "ac7f7231b63c234429c85281bfd36bd6371f739f394c37fcbaa682fe620a777d"
      },
      {
        "path": "compatibility/matrix.json",
        "repository": "aiverse-filmmakers/ai-verse-distribution",
        "revision": "ef802fc454546c535c9b724e9cc123875c34cca9",
        "sha256": "44ae0aeb11816427ef71aa83b748b1adfc653d5413a1b741bf6f9b49df98a554"
      }
    ]
  },
  "components": [
    {
      "descriptor": {
        "declared_revision": "4a134190355e590f4f52e0607ca13bbddd1ac36e",
        "path": "release/component-release.json",
        "release_status": "accepted",
        "sha256": "71e8ffd5ffa536192984a93a23b4bb1f98714dd55e4681cf1ab888aa9dc3bdd5",
        "source_revision": "50f9f678eb847dc447560020ecdb74b9ecc7ea20"
      },
      "id": "ai-verse-os",
      "owner_acceptance": {
        "accepted_revision": "4a134190355e590f4f52e0607ca13bbddd1ac36e",
        "evidence_revision": "50f9f678eb847dc447560020ecdb74b9ecc7ea20",
        "kind": "component-release-descriptor-native-ci",
        "result": "success",
        "run_id": 39927665194,
        "workflow": "Repository QC"
      },
      "repository": "https://github.com/aiverse-filmmakers/AI-Verse-OS.git",
      "revision": "4a134190355e590f4f52e0607ca13bbddd1ac36e"
    },
    {
      "descriptor": {
        "declared_revision": "7e6f7a7e8a3d541815bc7f65c11dca7824c35d8f",
        "path": "release/component-release.json",
        "release_status": "accepted",
        "sha256": "f24d2d3f74ca22f7205f6d6e8c2778263908dd489bbf9528f762b5d39acea82d",
        "source_revision": "6ad408e38b6b876cc8049f207fcba1e86ffd6554"
      },
      "id": "ai-verse-brain",
      "owner_acceptance": {
        "accepted_revision": "7e6f7a7e8a3d541815bc7f65c11dca7824c35d8f",
        "evidence_revision": "6ad408e38b6b876cc8049f207fcba1e86ffd6554",
        "kind": "component-release-descriptor-native-ci",
        "result": "success",
        "run_id": 39903370916,
        "workflow": "CI"
      },
      "repository": "https://github.com/aiverse-filmmakers/AI-Verse-Brain.git",
      "revision": "7e6f7a7e8a3d541815bc7f65c11dca7824c35d8f"
    },
    {
      "descriptor": {
        "declared_revision": "f1327be48ba2ee0043959021365e6dbb9dcb1d3a",
        "path": "release/component-release.json",
        "release_status": "accepted",
        "sha256": "9d8e636691742c7be62b123a944bb16b1e274ae937fc8fabc9c7795539ff1efb",
        "source_revision": "09911eae0b4b0cbf7e7e7969230fe5b86647b841"
      },
      "id": "ai-verse-memory",
      "owner_acceptance": {
        "accepted_revision": "f1327be48ba2ee0043959021365e6dbb9dcb1d3a",
        "evidence_revision": "09911eae0b4b0cbf7e7e7969230fe5b86647b841",
        "kind": "component-release-descriptor-native-ci",
        "result": "success",
        "run_id": 37686666851,
        "workflow": "Test"
      },
      "repository": "https://github.com/aiverse-filmmakers/AI-Verse-Memory.git",
      "revision": "f1327be48ba2ee0043959021365e6dbb9dcb1d3a"
    },
    {
      "descriptor": {
        "declared_revision": "390c6e1633afc809040bd1159840045f4f9ff27e",
        "path": "release/component-release.json",
        "release_status": "accepted",
        "sha256": "94baa36b0cd1a0c5469438447b9293b6b1567f58eb951c802ddcd40509960d38",
        "source_revision": "297c63a5be95f8319cc5755f287329c2e4387b02"
      },
      "id": "ai-verse-skills",
      "owner_acceptance": {
        "accepted_revision": "390c6e1633afc809040bd1159840045f4f9ff27e",
        "evidence_revision": "297c63a5be95f8319cc5755f287329c2e4387b02",
        "kind": "component-release-descriptor-native-ci",
        "result": "success",
        "run_id": 39927631275,
        "workflow": "Runtime Readiness"
      },
      "repository": "https://github.com/aiverse-filmmakers/AI-Verse-Skills.git",
      "revision": "390c6e1633afc809040bd1159840045f4f9ff27e"
    },
    {
      "descriptor": {
        "declared_revision": "f8978f8f7a1bc94edecddc2662112233289159a3",
        "path": "release/component-release.json",
        "release_status": "accepted",
        "sha256": "ac7f7231b63c234429c85281bfd36bd6371f739f394c37fcbaa682fe620a777d",
        "source_revision": "7e9fadbd73752b24eb79e270aff6b311ad508109"
      },
      "id": "ai-verse-data",
      "owner_acceptance": {
        "accepted_revision": "f8978f8f7a1bc94edecddc2662112233289159a3",
        "evidence_revision": "7e9fadbd73752b24eb79e270aff6b311ad508109",
        "kind": "component-release-descriptor-native-ci",
        "result": "success",
        "run_id": 37645269881,
        "workflow": "CI"
      },
      "repository": "https://github.com/aiverse-filmmakers/AI-Verse-Data.git",
      "revision": "f8978f8f7a1bc94edecddc2662112233289159a3"
    }
  ],
  "distribution": {
    "candidate_definition": {
      "path": "src/aiverse_distribution/catalog/core_candidates.json",
      "repository": "aiverse-filmmakers/ai-verse-distribution",
      "revision": "ef802fc454546c535c9b724e9cc123875c34cca9",
      "sha256": "53c85e5a14677c748ce3eca255c4550a9caee7d310d3da0c07aa05ecf1456dfd"
    },
    "candidate_revision": "ef802fc454546c535c9b724e9cc123875c34cca9",
    "repository": "aiverse-filmmakers/ai-verse-distribution"
  },
  "drift": {
    "records": [],
    "state_sha256": "30a612f1a91278bed853dee5ac4eefae4e9850a7f3acb54a909dbfb8b850733b"
  },
  "profile": "core",
  "registry": {
    "path": "governance/repository-registry.json",
    "repository": "aiverse-filmmakers/AI-Verse-System",
    "revision": "6035089e1713da5890449c601e582c0356de9f1b",
    "sha256": "d0cd07396aaf849cf5baae155f1389cf93f0b0f881ffb96d0595de2b229050ab"
  },
  "repository_state": {
    "path": "governance/repository-state.json",
    "repositories": [
      "aiverse-filmmakers/AI-Verse-Brain",
      "aiverse-filmmakers/AI-Verse-Data",
      "aiverse-filmmakers/AI-Verse-Memory",
      "aiverse-filmmakers/AI-Verse-OS",
      "aiverse-filmmakers/AI-Verse-Skills",
      "aiverse-filmmakers/AI-Verse-System",
      "aiverse-filmmakers/ai-verse-distribution"
    ],
    "repository": "aiverse-filmmakers/AI-Verse-System",
    "revision": "6035089e1713da5890449c601e582c0356de9f1b",
    "scope": "core",
    "sha256": "30a612f1a91278bed853dee5ac4eefae4e9850a7f3acb54a909dbfb8b850733b"
  },
  "schema": "aiverse.distribution-candidate-evidence/v1",
  "system": {
    "governance_contracts": [
      {
        "path": "docs/REPOSITORY-NETWORK-GOVERNANCE-CONTRACT.md",
        "repository": "aiverse-filmmakers/AI-Verse-System",
        "revision": "6035089e1713da5890449c601e582c0356de9f1b",
        "sha256": "176e31dcf30e68c3c5934667d23e02ddf40a1a2de11d12dcc49b80c7f8117235"
      },
      {
        "path": "docs/SAFE-UPDATE-AND-STATE-PRESERVATION-CONTRACT.md",
        "repository": "aiverse-filmmakers/AI-Verse-System",
        "revision": "6035089e1713da5890449c601e582c0356de9f1b",
        "sha256": "c026818b118cd07c9539f6bbbc1d97be42493bdc680e824d1f0183811f6ec793"
      }
    ],
    "repository": "aiverse-filmmakers/AI-Verse-System",
    "revision": "6035089e1713da5890449c601e582c0356de9f1b"
  },
  "toolchain": {
    "dependency_locks": [
      {
        "path": "src/aiverse_distribution/dependency_locks/ai-verse-data/f8978f8f7a1bc94edecddc2662112233289159a3/lock.json",
        "repository": "aiverse-filmmakers/ai-verse-distribution",
        "revision": "ef802fc454546c535c9b724e9cc123875c34cca9",
        "sha256": "0af6c9763fa04170b0bc6226764bb1c78db5296b5586a91d9d2851e27da98ea3"
      },
      {
        "path": "src/aiverse_distribution/dependency_locks/ai-verse-data/f8978f8f7a1bc94edecddc2662112233289159a3/package-lock.json",
        "repository": "aiverse-filmmakers/ai-verse-distribution",
        "revision": "ef802fc454546c535c9b724e9cc123875c34cca9",
        "sha256": "fa5c3e0f8df2c98fa48c4f7f163caff31a1ef16dc3e27223c217c38c6ff9ade3"
      }
    ],
    "runtime_requirements": {
      "git_lfs": true,
      "node_min": "22.23.3",
      "platforms": [
        "darwin",
        "linux",
        "win32"
      ],
      "python_min": "3.11"
    }
  }
}
